{
  "client": "baker-strategy",
  "domain": "bakerstrategy.com",
  "cloudflareAccountId": "e19918245a483360e7f4b4303c02afdf",
  "zoneId": "cf3ff60112e861cda5dbf18a482b9eae",
  "pagesProject": "bakerstrategy-site",
  "brand": {
    "name": "Baker Strategy",
    "logoLetters": "BS",
    "tagline": "Market Strategy • Execution • Growth",
    "description": "Baker Strategy provides clear, actionable market strategy so you can stop guessing and start growing with confidence."
  },
  "contact": {
    "to": "david@bakerstrategy.com",
    "from": "contact@bakerstrategy.com",
    "fromName": "Baker Strategy Website"
  },
  "successMessage": "Someone from Baker Strategy will get back to you soon at the email you provided."
}
